personality_type,emotion,financial_advice
Risk-Averse,Fear,"For risk-averse investors feeling fear, consider low-risk options like Fixed Deposits (FDs), Public Provident Fund (PPF), or Systematic Investment Plans (SIPs) in debt funds. These provide steady returns with minimal volatility."
Risk-Averse,Stress,"When stressed about finances, focus on building an emergency fund first. Aim for 6 months of expenses in a high-yield savings account. Then explore government bonds or corporate bonds for stable income."
Risk-Averse,Hesitation,"If you're hesitant about investing, start small with SIPs. Invest Rs 500-1000 monthly in balanced mutual funds. This builds confidence gradually without overwhelming risk."
Risk-Averse,Calm,"Maintain conservative portfolio: 70% debt funds, 20% equity funds, 10% gold. Focus on capital preservation over growth. Review annually."
Risk-Averse,Confidence,"Even with confidence, stay conservative. Consider hybrid funds that balance safety and growth. Never exceed 30% in equity."
Risk-Taker,Excitement,"High-risk investments can be exciting but dangerous. Diversify across sectors: stocks, crypto, commodities. Never invest more than 10% of portfolio in single high-risk asset."
Risk-Taker,Overconfidence,"Overconfidence leads to losses. Set stop-loss limits, take profits regularly, and maintain 60% in stable assets. Remember: markets can crash anytime."
Risk-Taker,Confidence,"Confident risk-takers should still diversify. Allocate 30% to stocks, 20% to bonds, 20% to real estate, 10% to crypto, 20% to emergency fund."
Risk-Taker,Fear,"When fear hits, don't abandon strategy. Reduce position sizes, add stop-losses. Keep 40% in stable assets as buffer."
Risk-Taker,Stress,"Stress from volatility? Reduce high-risk exposure to 30%. Increase bonds and cash. Take breaks from market watching."
Impulsive,Excitement,"Impulsive spending destroys wealth. Use 24-hour rule: wait a day before purchases above Rs 5000. Create monthly budget and stick to it."
Impulsive,Stress,"Stress spending is dangerous. Track expenses daily using apps. Set up automatic savings that deduct before you can spend. Build emergency fund first."
Impulsive,Fear,"Fear-based impulse decisions are costly. Create investment rules in advance. Use SIPs to automate investing and avoid timing mistakes."
Impulsive,Hesitation,"Hesitation before spending is good! Use this pause to evaluate needs vs wants. Create wishlist and wait 48 hours before buying."
Impulsive,Overconfidence,"Overconfidence leads to reckless spending. Set strict budget limits. Use cash envelopes for discretionary spending categories."
Emotional,Fear,"Emotional decisions lead to losses. When fearful, don't sell in panic. Consult a financial advisor. Focus on long-term goals, not daily market movements."
Emotional,Stress,"Financial stress needs systematic approach. List all debts, prioritize high-interest ones. Create realistic budget. Consider debt consolidation if needed."
Emotional,Excitement,"Excitement can cloud judgment. Set clear investment rules. Never invest more than 5% in single asset when emotional. Take time to think."
Emotional,Hesitation,"Hesitation from emotions? Break decisions into smaller steps. Start with small amounts. Build confidence gradually with low-risk options first."
Emotional,Overconfidence,"Emotional overconfidence is dangerous. Get second opinion from advisor. Review past mistakes. Stick to proven strategies, not gut feelings."
Neutral,Calm,"Maintain balanced portfolio: 50% equity, 30% debt, 10% gold, 10% cash. Review quarterly. Rebalance if allocation drifts more than 5%."
Neutral,Confidence,"Confident investors should still diversify. Don't put all eggs in one basket. Regular SIPs in mutual funds work best for steady growth."
Neutral,Stress,"Even neutral personalities feel stress. Focus on systematic investing through SIPs. Automate savings. Review portfolio only quarterly, not daily."
Neutral,Hesitation,"Hesitation is natural. Start with small SIPs in balanced funds. Increase gradually as confidence builds. Research thoroughly before decisions."
Neutral,Fear,"Fear affects everyone. Build emergency fund first (6 months expenses). Then start with 70% debt, 30% equity. Gradually increase equity exposure."
Risk-Averse,Excitement,"Even excited, stay conservative. Maximum 20% in equity funds. Rest in FDs, bonds, PPF. Excitement shouldn't override risk tolerance."
Risk-Averse,Overconfidence,"Overconfidence is dangerous for risk-averse. Stick to proven safe instruments. Avoid new investment fads. Consult advisor before changes."
Impulsive,Calm,"Use calm moments to set up automatic systems. Auto-debit for savings, SIPs for investments. Remove temptation by automating good habits."
Impulsive,Confidence,"Confidence can lead to more impulsive decisions. Set strict rules: max 10% in any single investment. Use cooling-off period for large purchases."
Emotional,Calm,"Calm moments are perfect for planning. Create written financial goals. Set up automatic systems. Make decisions when calm, not emotional."
Emotional,Confidence,"Emotional confidence can be misleading. Get objective financial review. Use robo-advisors for unbiased recommendations. Avoid emotional trading."
Risk-Taker,Hesitation,"Hesitation is healthy for risk-takers. Research thoroughly. Start with small positions. Scale up only after seeing results. Never go all-in."
Risk-Taker,Calm,"Use calm periods to plan risk management. Set stop-losses. Define exit strategies. Maintain emergency fund equal to 6 months expenses."
Risk-Taker,Excitement,"For stock market analysis, use technical indicators like RSI, MACD, and moving averages. Monitor volume patterns and support/resistance levels. Never invest more than 10% in single stock. Use live market data to make informed decisions, not emotional ones."
Risk-Taker,Confidence,"Advanced stock trading requires understanding P/E ratios, earnings reports, and market sentiment. Use fintech platforms for real-time analysis. Diversify across sectors: tech, finance, healthcare. Set trailing stop-losses at 5-10% below entry price."
Risk-Taker,Fear,"When markets are volatile, use options strategies like protective puts or covered calls. Monitor VIX index for fear levels. Reduce position sizes during high volatility. Use fintech tools for automated risk management."
Risk-Taker,Stress,"Market stress? Use algorithmic trading tools to remove emotion. Set up automated rebalancing. Monitor portfolio beta to understand market correlation. Take breaks from live market watching - check only 2-3 times daily."
Neutral,Calm,"For live market analysis, focus on fundamental analysis: company financials, industry trends, economic indicators. Use fintech platforms for portfolio tracking. Maintain 50% large-cap, 30% mid-cap, 20% small-cap stocks. Review quarterly earnings."
Neutral,Confidence,"Advanced investing: Use robo-advisors for systematic rebalancing. Monitor sector rotation and economic cycles. Consider factor investing (value, growth, momentum). Use fintech apps for tax-loss harvesting and optimization."
Neutral,Stress,"Market analysis stress? Automate your strategy. Use dollar-cost averaging for stocks. Set up alerts for significant price movements. Use fintech tools for portfolio analytics instead of manual tracking."
Neutral,Hesitation,"Hesitant about stock picking? Start with index funds and ETFs. Use fintech platforms for paper trading to practice. Learn technical analysis gradually. Consider robo-advisors for automated management."
Risk-Averse,Fear,"For stock market fear, stick to blue-chip stocks with strong fundamentals. Use defensive sectors: utilities, consumer staples. Monitor dividend yield and payout ratios. Use fintech tools for risk assessment before investing."
Risk-Averse,Confidence,"Even confident, stay conservative with stocks. Focus on dividend aristocrats and low-volatility ETFs. Use fintech platforms for portfolio risk analysis. Never exceed 20% in individual stocks, rest in diversified funds."
Emotional,Fear,"Emotional about market volatility? Use stop-loss orders automatically. Avoid day trading - focus on long-term positions. Use fintech tools for emotion-free rebalancing. Consult advisor before major decisions during fear."
Emotional,Excitement,"Excitement in markets is dangerous. Use fintech platforms to set automatic limits. Never chase hot stocks based on hype. Stick to your investment plan. Use technical analysis tools objectively, not emotionally."
Impulsive,Excitement,"Impulsive stock trading destroys wealth. Use fintech platforms with cooling-off periods. Set maximum position sizes (5% per stock). Use paper trading first. Implement 24-hour rule before any stock purchase above Rs 10,000."
Impulsive,Stress,"Stress trading? Use automated investment systems. Set up SIPs in stocks via fintech apps. Remove market apps from phone during stress. Use robo-advisors to prevent impulsive decisions."
Neutral,Calm,"For fintech adoption, use platforms for automated savings, investment tracking, and bill payments. Explore robo-advisors for systematic investing. Use budgeting apps to track expenses. Leverage AI-powered portfolio analysis tools."
Risk-Taker,Calm,"Advanced fintech: Use algorithmic trading platforms for systematic strategies. Explore DeFi for crypto exposure. Use portfolio analytics tools for risk assessment. Monitor live market data through fintech dashboards. Set automated rebalancing rules."
Risk-Averse,Calm,"Fintech for safety: Use apps for FD and bond tracking. Explore government bond platforms. Use expense tracking apps to build emergency fund. Leverage robo-advisors with conservative settings. Monitor portfolio through secure fintech platforms."
Emotional,Calm,"Use fintech to remove emotions: Automated SIPs, robo-advisors, and portfolio rebalancing. Set up alerts instead of constant checking. Use AI-powered analysis for objective insights. Implement systematic investment plans."
Neutral,Excitement,"Excited about fintech? Start with basic apps for expense tracking and savings. Gradually explore investment platforms. Use paper trading features to learn. Don't rush into advanced trading - build knowledge first."
Risk-Taker,Hesitation,"Hesitant about advanced trading? Use fintech platforms for paper trading. Learn technical analysis through educational tools. Start with small positions. Use live market simulators before real money."
Neutral,Fear,"Fearful of market analysis? Use fintech robo-advisors for automated management. Focus on index funds instead of stock picking. Use portfolio analytics to understand risk. Set up automatic rebalancing to reduce decision stress."